xrun(64): 22.09-s003: (c) Copyright 1995-2022 Cadence Design Systems, Inc.
TOOL:	xrun(64)	22.09-s003: Started on Dec 26, 2024 at 18:38:47 IST
xrun
	-f compile_file.f
		../APB_RTL/APB_Master.v
		../uvm_testbench/apb_top/apb_interface.sv
		../uvm_testbench/apb_top/apb_test_pkg.sv
		../uvm_testbench/apb_test/apb_top.sv
	-uvmhome CDNS-1.1d
	+UVM_TESTNAME=apb_read_test
	-seed 167
	-debug
	-access +rwc
	-covdut apb_master
	-covworkdir cov_work
	-logfile logs/20241226_183847_apb_read_test_167/apb_read_test_None_20241226_183847.log
	+UVM_VERBOSITY=UVM_MEDIUM
	-coverage all
	-covoverwrite

   User defined plus("+") options:
	+UVM_VERBOSITY=UVM_MEDIUM

Loading snapshot worklib.apb_top:sv .................... Done
SVSEED set from command line: 167
xmsim: *W,DSEM2009: This SystemVerilog design is simulated as per IEEE 1800-2009 SystemVerilog simulation semantics. Use -disable_sem2009 option for turning off SV 2009 simulation semantics.
xcelium> source /tools/cadence_march2021/XCELIUM2209/tools/xcelium/files/xmsimrc
xcelium> source /tools/cadence_march2021/XCELIUM2209/tools/methodology/UVM/CDNS-1.1d/additions/sv/files/tcl/uvm_sim.tcl
xcelium> run
----------------------------------------------------------------
CDNS-UVM-1.1d (22.09-s003)
(C) 2007-2013 Mentor Graphics Corporation
(C) 2007-2013 Cadence Design Systems, Inc.
(C) 2006-2013 Synopsys, Inc.
(C) 2011-2013 Cypress Semiconductor Corp.
----------------------------------------------------------------

  ***********       IMPORTANT RELEASE NOTES         ************

  You are using a version of the UVM library that has been compiled
  with `UVM_NO_DEPRECATED undefined.
  See http://www.eda.org/svdb/view.php?id=3313 for more details.

  You are using a version of the UVM library that has been compiled
  with `UVM_OBJECT_MUST_HAVE_CONSTRUCTOR undefined.
  See http://www.eda.org/svdb/view.php?id=3770 for more details.

      (Specify +UVM_NO_RELNOTES to turn off this notice)

UVM_INFO @ 0: reporter [RNTST] Running test apb_read_test...
UVM_INFO ../uvm_testbench/apb_agent/apb_agent_jtag.sv(16) @ 0: uvm_test_top.env.apj [apb_agent_jtag] build phase started
UVM_INFO ../uvm_testbench/apb_agent/apb_driver.sv(11) @ 0: uvm_test_top.env.apj.dri [apb_driver_jtag] build phase started
UVM_INFO ../uvm_testbench/apb_agent/apb_monitor.sv(16) @ 0: uvm_test_top.env.apj.mon [apb_monitor] build phase started
UVM_INFO ../uvm_testbench/apb_agent/apb_agent_slave.sv(41) @ 0: uvm_test_top.env.aps [apb_slave_agent] build phase started
UVM_INFO ../uvm_testbench/apb_agent/apb_driver_slave.sv(12) @ 0: uvm_test_top.env.aps.dri_s [apb_slave_driver] build phase started
UVM_INFO ../uvm_testbench/apb_sequence/apb_sequence_write.sv(55) @ 0: uvm_test_top.env.apj.seqr@@jseq [apb_jtag_write_sequence] in sequene body
UVM_INFO ../uvm_testbench/apb_sequence/apb_sequence_slave_rw.sv(13) @ 0: uvm_test_top.env.aps.seqr_s@@slseq [apb_slave_fixed_response_seq] in sequence body
UVM_INFO ../uvm_testbench/apb_agent/apb_driver_slave.sv(25) @ 0: uvm_test_top.env.aps.dri_s [apb_slave_driver] psel _driver running
--------------------------------------------------------
Name                   Type                  Size  Value
--------------------------------------------------------
trans                  apb_jtag_transaction  -     @4641
  transfer             integral              1     'h0  
  read                 integral              1     'h0  
  write                integral              1     'h0  
  apb_paddr            integral              32    'h0  
  apb_write_data       integral              32    'h0  
  prdata               integral              32    'h0  
  pready               integral              1     'h0  
  pslverr              integral              1     'h0  
  psel                 integral              1     'h0  
  pwrite               integral              1     'h0  
  paddr                integral              32    'h0  
  pwdata               integral              32    'h0  
  apb_read_data_out    integral              32    'h0  
  apb_read_data_valid  integral              1     'h0  
--------------------------------------------------------
UVM_INFO ../uvm_testbench/apb_sequence/apb_sequence_write.sv(65) @ 20000: uvm_test_top.env.apj.seqr@@jseq [apb_jtag_write_sequence] jtag sequence completed
--------------------------------------------------------
Name                   Type                  Size  Value
--------------------------------------------------------
trans                  apb_jtag_transaction  -     @4785
  transfer             integral              1     'h0  
  read                 integral              1     'h0  
  write                integral              1     'h0  
  apb_paddr            integral              32    'h0  
  apb_write_data       integral              32    'h0  
  prdata               integral              32    'h0  
  pready               integral              1     'h0  
  pslverr              integral              1     'h0  
  psel                 integral              1     'h0  
  pwrite               integral              1     'h0  
  paddr                integral              32    'h0  
  pwdata               integral              32    'h0  
  apb_read_data_out    integral              32    'h0  
  apb_read_data_valid  integral              1     'h0  
--------------------------------------------------------
the value of slave error is 1
UVM_INFO ../uvm_testbench/apb_sequence/apb_sequence_slave_rw.sv(22) @ 30000: uvm_test_top.env.aps.seqr_s@@slseq [apb_slave_fixed_response_seq] slave sequence completed
UVM_INFO ../uvm_testbench/apb_sequence/apb_sequence_write.sv(55) @ 30000: uvm_test_top.env.apj.seqr@@jseq [apb_jtag_write_sequence] in sequene body
UVM_INFO ../uvm_testbench/apb_sequence/apb_sequence_slave_rw.sv(13) @ 30000: uvm_test_top.env.aps.seqr_s@@slseq [apb_slave_fixed_response_seq] in sequence body
UVM_INFO ../uvm_testbench/apb_agent/apb_driver_slave.sv(25) @ 30000: uvm_test_top.env.aps.dri_s [apb_slave_driver] psel _driver running
UVM_INFO ../uvm_testbench/apb_agent/apb_driver.sv(24) @ 30000: uvm_test_top.env.apj.dri [apb_driver_jtag] write instructions from sequence received given
-----------------------------------------------------------------------------------------
Name                           Type                  Size  Value                         
-----------------------------------------------------------------------------------------
write_transaction              apb_jtag_transaction  -     @4763                         
  transfer                     integral              1     'h1                           
  read                         integral              1     'h1                           
  write                        integral              1     'h0                           
  apb_paddr                    integral              32    'h1ecaf3a4                    
  apb_write_data               integral              32    'ha385203e                    
  prdata                       integral              32    'h0                           
  pready                       integral              1     'h0                           
  pslverr                      integral              1     'h0                           
  psel                         integral              1     'h0                           
  pwrite                       integral              1     'h0                           
  paddr                        integral              32    'h0                           
  pwdata                       integral              32    'h0                           
  apb_read_data_out            integral              32    'h0                           
  apb_read_data_valid          integral              1     'h0                           
  begin_time                   time                  64    30000                         
  depth                        int                   32    'd2                           
  parent sequence (name)       string                4     jseq                          
  parent sequence (full name)  string                30    uvm_test_top.env.apj.seqr.jseq
  sequencer                    string                25    uvm_test_top.env.apj.seqr     
-----------------------------------------------------------------------------------------
UVM_INFO ../uvm_testbench/apb_agent/apb_driver.sv(33) @ 30000: uvm_test_top.env.apj.dri [apb_driver_jtag] write instructions given
UVM_INFO ../uvm_testbench/apb_agent/apb_driver.sv(38) @ 30000: uvm_test_top.env.apj.dri [apb_driver_jtag] penable went low
-------------------------------------------------------------
Name                   Type                  Size  Value     
-------------------------------------------------------------
trans                  apb_jtag_transaction  -     @4789     
  transfer             integral              1     'h1       
  read                 integral              1     'h1       
  write                integral              1     'h0       
  apb_paddr            integral              32    'h1ecaf3a4
  apb_write_data       integral              32    'ha385203e
  prdata               integral              32    'h0       
  pready               integral              1     'h0       
  pslverr              integral              1     'h0       
  psel                 integral              1     'h0       
  pwrite               integral              1     'h0       
  paddr                integral              32    'h0       
  pwdata               integral              32    'h0       
  apb_read_data_out    integral              32    'h0       
  apb_read_data_valid  integral              1     'h0       
-------------------------------------------------------------
UVM_INFO ../uvm_testbench/apb_agent/apb_driver_slave.sv(32) @ 70000: uvm_test_top.env.aps.dri_s [apb_slave_driver] psel detected high by slave
UVM_INFO ../uvm_testbench/apb_agent/apb_driver_slave.sv(38) @ 70000: uvm_test_top.env.aps.dri_s [apb_slave_driver] high enable detected by slave
UVM_INFO ../uvm_testbench/apb_agent/apb_monitor.sv(62) @ 70000: uvm_test_top.env.apj.mon [apb_monitor] from monitor after sampling
-------------------------------------------------------------
Name                   Type                  Size  Value     
-------------------------------------------------------------
trans                  apb_jtag_transaction  -     @4789     
  transfer             integral              1     'h1       
  read                 integral              1     'h1       
  write                integral              1     'h0       
  apb_paddr            integral              32    'h1ecaf3a4
  apb_write_data       integral              32    'ha385203e
  prdata               integral              32    'h0       
  pready               integral              1     'h0       
  pslverr              integral              1     'h0       
  psel                 integral              1     'h1       
  pwrite               integral              1     'h0       
  paddr                integral              32    'h1ecaf3a4
  pwdata               integral              32    'h0       
  apb_read_data_out    integral              32    'h0       
  apb_read_data_valid  integral              1     'h0       
-------------------------------------------------------------
UVM_INFO ../uvm_testbench/apb_env/apb_scoreboard.sv(27) @ 70000: uvm_test_top.env.scb [apb_scoreboard] write operation performed successfully apb_read_data_out = 00000000,  apb_prdata = 00000000
UVM_INFO ../uvm_testbench/apb_agent/apb_driver.sv(43) @ 90000: uvm_test_top.env.apj.dri [apb_driver_jtag] penable went high
-------------------------------------------------------------
Name                   Type                  Size  Value     
-------------------------------------------------------------
trans                  apb_jtag_transaction  -     @4662     
  transfer             integral              1     'h1       
  read                 integral              1     'h1       
  write                integral              1     'h0       
  apb_paddr            integral              32    'h1ecaf3a4
  apb_write_data       integral              32    'ha385203e
  prdata               integral              32    'hd4c241d4
  pready               integral              1     'h0       
  pslverr              integral              1     'h0       
  psel                 integral              1     'h1       
  pwrite               integral              1     'h0       
  paddr                integral              32    'h1ecaf3a4
  pwdata               integral              32    'ha385203e
  apb_read_data_out    integral              32    'hd4c241d4
  apb_read_data_valid  integral              1     'h1       
-------------------------------------------------------------
the value of slave error is 0
UVM_INFO ../uvm_testbench/apb_sequence/apb_sequence_slave_rw.sv(22) @ 90000: uvm_test_top.env.aps.seqr_s@@slseq [apb_slave_fixed_response_seq] slave sequence completed
UVM_INFO ../uvm_testbench/apb_agent/apb_driver.sv(50) @ 90000: uvm_test_top.env.apj.dri [apb_driver_jtag] penable went low for next transaction
UVM_INFO ../uvm_testbench/apb_agent/apb_driver.sv(51) @ 90000: uvm_test_top.env.apj.dri [apb_driver_jtag] transaction completed
UVM_INFO ../uvm_testbench/apb_sequence/apb_sequence_write.sv(65) @ 90000: uvm_test_top.env.apj.seqr@@jseq [apb_jtag_write_sequence] jtag sequence completed
UVM_INFO /tools/cadence_march2021/XCELIUM2209/tools/methodology/UVM/CDNS-1.1d/sv/src/base/uvm_objection.svh(1268) @ 90000: reporter [TEST_DONE] 'run' phase is ready to proceed to the 'extract' phase

--- UVM Report catcher Summary ---


Number of demoted UVM_FATAL reports  :    0
Number of demoted UVM_ERROR reports  :    0
Number of demoted UVM_WARNING reports:    0
Number of caught UVM_FATAL reports   :    0
Number of caught UVM_ERROR reports   :    0
Number of caught UVM_WARNING reports :    0

--- UVM Report Summary ---

** Report counts by severity
UVM_INFO :   27
UVM_WARNING :    0
UVM_ERROR :    0
UVM_FATAL :    0
** Report counts by id
[RNTST]     1
[TEST_DONE]     1
[apb_agent_jtag]     1
[apb_driver_jtag]     7
[apb_jtag_write_sequence]     4
[apb_monitor]     2
[apb_scoreboard]     1
[apb_slave_agent]     1
[apb_slave_driver]     5
[apb_slave_fixed_response_seq]     4
Simulation complete via $finish(1) at time 90 NS + 57
/tools/cadence_march2021/XCELIUM2209/tools/methodology/UVM/CDNS-1.1d/sv/src/base/uvm_root.svh:457     $finish;
xcelium> exit

coverage setup:
  workdir  :  cov_work
  dutinst  :  apb_top.dut(apb_master)
  scope    :  scope
  testname :  test_sv167

coverage files:
  model(design data) :  cov_work/scope/icc_4eb6f5eb_00000000.ucm (reused)
  data               :  cov_work/scope/test_sv167/icc_4eb6f5eb_00000000.ucd
TOOL:	xrun(64)	22.09-s003: Exiting on Dec 26, 2024 at 18:38:48 IST  (total: 00:00:01)
